"sprint_number","sprint_name","sprint_goal","start_date","end_date","duration_days","total_story_points","estimated_hours","team_capacity_hours","capacity_utilization","task_count","epic_coverage","key_deliverables","demo_objectives","success_criteria","risk_factors","mitigation_strategies","dependencies_resolved","team_members","external_dependencies","integration_windows","review_schedule","retrospective_date","burndown_target"
"1","Sprint 1: Foundations & Core Master Data","Establish foundational system: User roles, RBAC, core master data models (Customer, Driver, Vehicle, Route, Material), and user login.","2025-01-06","2025-01-17","10","23","23","160","14%","9","Core System & Odoo Foundation, Master Data Management","Functional user login, Core RBAC structure, All primary master data models created.","Admin can log in and create a new record for a Vehicle, Driver, Customer, Route, and Material.","All master data models are defined and accessible in the UI to an Admin; RBAC groups are created.","Incomplete requirements for master data fields.","Confirm all fields with PO before starting development.","true","odoo.dev@company.com,qa.eng@company.com","None","N/A","2025-01-17 14:00","2025-01-17","Linear burndown to 0 points."
"2","Sprint 2: Master Data Refinement & Trip Creation","Complete Master Data Management (Edit, Deactivate) and implement core Trip Creation workflow with all necessary validations.","2025-01-20","2025-01-31","10","21","21","160","13%","11","Core System & Odoo Foundation, Master Data Management, Trip Lifecycle Management","Ability to edit and deactivate users/master data; A functional 'Create Trip' form.","Show deactivation of a user; Demonstrate all validations on the 'Create Trip' form.","A Dispatch Manager can successfully create a 'Planned' trip with valid data.","Complexity in validation logic for trip creation.","Write comprehensive unit tests for all validation rules.","true","odoo.dev@company.com,qa.eng@company.com","None","N/A","2025-01-31 14:00","2025-01-31","Linear burndown to 0 points."
"3","Sprint 3: Trip Assignment & Compliance","Implement Trip Assignment workflow with all compliance validations and add document management.","2025-02-03","2025-02-14","10","20","20","160","13%","7","Trip Lifecycle Management, Master Data Management","Ability to assign a driver/vehicle to a trip; Document upload for vehicles.","Show filtered lists of available drivers/vehicles during assignment; Demonstrate validations (capacity, license); Upload a vehicle document.","A 'Planned' trip can be successfully moved to 'Assigned' state with compliant resources.","Logic for resource 'availability' might be complex.","Clearly define 'availability' with PO (e.g., only checks 'In-Transit' status).","true","odoo.dev@company.com,qa.eng@company.com","None","N/A","2025-02-14 14:00","2025-02-14","Linear burndown to 0 points."
"4","Sprint 4: Driver Portal MVP","Deliver Driver Portal MVP: Login, view assigned trips, start a trip, log events, and upload Proof of Delivery.","2025-02-17","2025-02-28","10","20","20","160","13%","5","Driver Portal & Mobile Experience","A functional mobile web portal for drivers with core trip execution workflow.","Demonstrate the complete driver workflow on a mobile device: Login -> View Trips -> Start Trip -> Log Event -> Upload POD -> Trip is 'Delivered'.","A driver can complete their core workflow without assistance.","Mobile responsiveness issues across different devices; Complexity in OWL components.","Test on a range of emulators and physical devices.","true","frontend.dev@company.com,odoo.dev@company.com,qa.eng@company.com","None","N/A","2025-02-28 14:00","2025-02-28","Linear burndown to 0 points."
"5","Sprint 5: Expense Workflow & Trip Exceptions","Implement the complete Expense Submission and Approval workflow, and add core Trip Exception Handling.","2025-03-03","2025-03-14","10","20","20","160","13%","8","Financial Management & Invoicing, Trip Lifecycle Management","Driver expense submission form; Manager approval queue; Trip exception handling (On Hold, Cancel).","Driver submits an expense -> Manager approves/rejects it. Driver logs a critical event -> Trip goes 'On Hold' -> Manager resumes trip.","End-to-end expense workflow is functional; Trip exception states are manageable.","Complexity of state transitions and their side-effects (e.g., notifications).","Create state diagram and write integration tests for all transitions.","true","odoo.dev@company.com,frontend.dev@company.com,qa.eng@company.com","None","N/A","2025-03-14 14:00","2025-03-14","Linear burndown to 0 points."
"6","Sprint 6: Financial Calculations & Invoicing Prep","Solidify financial calculations by implementing trip profitability, adding robust expense validations, and creating the draft invoice workflow.","2025-03-17","2025-03-28","10","14","14","160","9%","7","Financial Management & Invoicing, Trip Lifecycle Management","Accurate trip profitability calculation; Validated expense data entry; 'Create Invoice' button on completed trips.","Show a trip's profitability update as an expense is approved; Demonstrate odometer and file validation on expense form; Create a draft invoice from a trip.","All financial calculations are validated and correct; Draft invoice generation is functional.","Accuracy of financial calculations.","Peer review of all calculation logic and extensive unit testing with edge cases.","true","odoo.dev@company.com,qa.eng@company.com","None","N/A","2025-03-28 14:00","2025-03-28","Linear burndown to 0 points."
"7","Sprint 7: E-Invoicing Integration","CRITICAL: Implement the end-to-end GST E-Invoicing integration, including the GSP client, workflow, and failure/intervention handling.","2025-03-31","2025-04-11","10","36","36","160","23%","4","Financial Management & Invoicing","A functional, compliant e-invoicing system with resilient API communication.","Generate a live (sandbox) e-invoice; Show sync/async fallback on simulated API failure; Demonstrate manual intervention workflow.","An invoice can be successfully processed to get an IRN from the GSP sandbox; PDF report is compliant.","GSP API instability or poor documentation (RISK-001); Complexity of sync/async logic.","Start with API technical spike; Implement comprehensive logging; Write extensive integration tests with a mock server.","","backend.dev@company.com,odoo.dev@company.com,qa.eng@company.com","GSP Sandbox API","Continuous integration with GSP sandbox throughout the sprint.","2025-04-11 14:00","2025-04-11","Steep burndown in the second week after initial integration challenges."
"8","Sprint 8: Financial Close & Notifications","Complete the core financial loop with payment recording and customer ledgers. Establish the foundational notification system and card management.","2025-04-14","2025-04-25","10","17","17","160","11%","4","Financial Management & Invoicing, Core System & Odoo Foundation","Payment recording functionality; Customer ledger view; Centralized notification service; Card management module.","Record a payment against an invoice; Show the updated customer ledger; Trigger a sample notification.","The trip-to-cash cycle is functionally complete; The notification system is ready for integration.","Complexity of running balance calculation in the ledger.","Investigate Odoo's standard partner ledger first before building custom logic.","true","odoo.dev@company.com,qa.eng@company.com","None","N/A","2025-04-25 14:00","2025-04-25","Linear burndown to 0 points."
"9","Sprint 9: Dashboards & Alerts","Surface data via dashboards and alerts, and configure notifications.","2025-04-28","2025-05-09","10","34","34","160","21%","5","Reporting & Dashboards, Core System & Odoo Foundation","Manager Dashboard with KPIs; Critical Alerts Panel; Alert generation logic for documents, licenses, and card balances; Notification preference screen.","Show the manager dashboard with live data; Trigger an alert (e.g., by lowering card balance) and see it appear on the dashboard; Configure notification preferences.","Dashboard is functional and provides at-a-glance insights; Alerts are generated and displayed correctly.","Performance of dashboard queries; Real-time update complexity.","Optimize data aggregation queries; Leverage Odoo's bus for real-time UI updates.","true","frontend.dev@company.com,odoo.dev@company.com,qa.eng@company.com","None","N/A","2025-05-09 14:00","2025-05-09","Linear burndown to 0 points."
"10","Sprint 10: Core Reporting Suite","Deliver core operational and financial reporting suites with export functionality.","2025-05-12","2025-05-23","10","21","21","160","13%","2","Reporting & Dashboards","Operational reports (Trip, Utilization, etc.); Financial reports (Aging, Revenue, etc.); PDF/Excel export for all reports.","Generate each report with filters applied; Export a report to both PDF and Excel.","All specified reports are functional and data is accurate; Exports are well-formatted.","Performance of reporting queries on large datasets.","Use optimized SQL queries via `env.cr.execute()` instead of the ORM for complex aggregations; Add database indexes on filtered fields.","true","odoo.dev@company.com,qa.eng@company.com","None","N/A","2025-05-23 14:00","2025-05-23","Linear burndown to 0 points."
"11","Sprint 11: Advanced Analytics & Self-Service","Deliver advanced analytical reports and add driver self-service features.","2025-05-26","2025-06-06","10","34","34","160","21%","6","Reporting & Dashboards, Driver Portal & Mobile Experience","Driver Performance, Fuel Efficiency, Vehicle Profitability, and Detailed Expense reports; Driver cash advance and leave request features.","Generate the new reports; Demonstrate a driver submitting a leave request.","All reports are functional; New driver portal features are working.","Data quality issues impacting report accuracy (e.g., missing odometer readings).","Handle null/missing data gracefully in report calculations (show 'N/A').","true","odoo.dev@company.com,frontend.dev@company.com,qa.eng@company.com","None","N/A","2025-06-06 14:00","2025-06-06","Linear burndown to 0 points."
"12","Sprint 12: CI/CD & Containerization","Establish CI/CD foundation: Containerize applications and build the CI pipeline for automated quality checks.","2025-06-09","2025-06-20","10","18","18.2","160","11%","1","System Infrastructure & DevOps (IaC/CI/CD)","Dockerfiles for Odoo and FastAPI; A functional GitHub Actions CI pipeline.","Show a pull request triggering the CI pipeline; Demonstrate a build failing due to a linting error or failed test.","CI pipeline enforces all quality gates (lint, test, coverage) on every pull request.","Complexity in setting up Odoo test environment in a CI runner.","Use a pre-built Odoo Docker image as a base.","true","devops.eng@company.com","None","N/A","2025-06-20 14:00","2025-06-20","Linear burndown to 0 points."
"13","Sprint 13: Infrastructure as Code (AWS)","Provision core AWS infrastructure using Terraform, focusing on the EKS cluster and managed services.","2025-06-23","2025-07-04","10","40","60","160","38%","1","System Infrastructure & DevOps (IaC/CI/CD)","A production-ready EKS cluster, VPC, and managed services (RDS, S3, etc.) defined in Terraform.","Run `terraform plan` and `terraform apply` to provision the staging environment; Connect to the EKS cluster with `kubectl`.","The entire AWS staging environment can be created and destroyed repeatably using Terraform.","High complexity of EKS and IAM configuration (RISK-003).","Use official Terraform modules; extensive testing in a non-production AWS account.","true","devops.eng@company.com","AWS Account","N/A","2025-07-04 14:00","2025-07-04","Linear burndown to 0 points."
"14","Sprint 14: System Hardening & Go-Live Prep","Finalize system for Go-Live: Implement security hardening, audit trails, data migration, and user training materials.","2025-07-07","2025-07-18","10","57","57","160","36%","7","Core System & Odoo Foundation, Project Management","Session timeout feature; Immutable audit trail; Data migration scripts; User training materials.","Show session timeout warning; View audit trail for a changed record; Demonstrate a data migration dry-run.","System is feature-complete, secure, and ready for UAT and production deployment.","Data migration complexity and risk of data corruption (RISK-002).","Mandate multiple successful dry-runs of migration scripts in staging.","true","odoo.dev@company.com,data.eng@company.com,tech.writer@company.com,qa.eng@company.com","Legacy system data extract.","N/A","2025-07-18 14:00","2025-07-18","Linear burndown to 0 points."